{
  "$schema": "https://json-schema.org/draft/2020-12/schema",
  "$id": "https://ernie.sg/schemas/extraction-bakeoff-corpus-1.0.0.json",
  "title": "Extraction architecture bake-off corpus binding",
  "type": "object",
  "additionalProperties": false,
  "required": [
    "schemaVersion",
    "id",
    "privacy",
    "sourcePolicy",
    "splits",
    "layouts",
    "strata",
    "groundTruthPolicy",
    "heldOutPolicy",
    "runner",
    "reportSchema"
  ],
  "properties": {
    "schemaVersion": { "const": "1.0.0" },
    "id": { "$ref": "#/$defs/id" },
    "privacy": { "const": "synthetic-identities-hashes-metrics-only" },
    "sourcePolicy": { "type": "string", "minLength": 1 },
    "splits": {
      "type": "object",
      "additionalProperties": false,
      "required": ["development", "held-out"],
      "properties": {
        "development": { "$ref": "#/$defs/split" },
        "held-out": { "$ref": "#/$defs/split" }
      }
    },
    "layouts": {
      "type": "array",
      "minItems": 2,
      "uniqueItems": true,
      "items": { "enum": ["one-column", "two-column"] }
    },
    "strata": {
      "type": "array",
      "minItems": 8,
      "uniqueItems": true,
      "items": { "$ref": "#/$defs/id" }
    },
    "groundTruthPolicy": { "type": "string", "minLength": 1 },
    "heldOutPolicy": { "type": "string", "minLength": 1 },
    "runner": { "type": "string", "minLength": 1 },
    "reportSchema": { "type": "string", "minLength": 1 }
  },
  "$defs": {
    "id": {
      "type": "string",
      "minLength": 1,
      "maxLength": 192,
      "pattern": "^[A-Za-z0-9][A-Za-z0-9._:-]*$"
    },
    "split": {
      "type": "object",
      "additionalProperties": false,
      "required": ["status", "documentIds"],
      "properties": {
        "status": { "enum": ["fixture", "owner-local"] },
        "documentIds": {
          "type": "array",
          "minItems": 1,
          "uniqueItems": true,
          "items": { "$ref": "#/$defs/id" }
        }
      }
    }
  }
}
